{
  "schema": "governance.design-system.legacy-design-runtime-inventory.v1",
  "version": "1.0.0",
  "authorizationScope": "UI1_SPARK_TOSS_FOUNDATION_AND_ZERO_LUX_RUNTIME_CONTRACT_V1",
  "baseSha": "f9925f6eaf56c90eec400848f8314a3bda378be2",
  "goal": "LEGACY_LUX_DESIGN_RUNTIME_PATHS = 0",
  "zeroLuxComplete": false,
  "homeResidualNote": "Production / uses spark-dash-home. Residual LUX is leftover HomeExperience/HomePageClient plus shared globals.css.",
  "accountHubResidualNote": "Locked AccountHub files have no LUX import. Residual is shared globals.css plus sibling /me routes and account.module.css.",
  "nextApproval": "UI2_ZERO_LUX_RUNTIME_MIGRATION_NON_HOME_V1",
  "rows": [
    {
      "file": "apps/admin/app/admin/adapters/page.tsx",
      "lineOrSymbol": "108:class:<main className=\"p-6 text-lux-text\" data-surface=\"admin-adapters\" data-testid=\"admin-adapters-page\">",
      "classification": "LUX_RUNTIME_CLASS",
      "surface": "admin",
      "productionRuntime": true,
      "home": false,
      "accountHub": false,
      "removalMethod": "replace with spark-toss tokens/primitives in a later approved slice",
      "requiredApproval": "UI2_ZERO_LUX_RUNTIME_MIGRATION_NON_HOME_V1",
      "blocker": "legacy design runtime still shipping"
    },
    {
      "file": "apps/admin/app/admin/ai-logs/page.tsx",
      "lineOrSymbol": "144:class:<main className=\"p-6 text-lux-text\" data-canon=\"admin-ai-logs\" data-testid=\"admin-ai-logs-page\">",
      "classification": "LUX_RUNTIME_CLASS",
      "surface": "admin",
      "productionRuntime": true,
      "home": false,
      "accountHub": false,
      "removalMethod": "replace with spark-toss tokens/primitives in a later approved slice",
      "requiredApproval": "UI2_ZERO_LUX_RUNTIME_MIGRATION_NON_HOME_V1",
      "blocker": "legacy design runtime still shipping"
    },
    {
      "file": "apps/admin/app/admin/audit/page.tsx",
      "lineOrSymbol": "26:class:className=\"p-6 text-lux-text\"",
      "classification": "LUX_RUNTIME_CLASS",
      "surface": "admin",
      "productionRuntime": true,
      "home": false,
      "accountHub": false,
      "removalMethod": "replace with spark-toss tokens/primitives in a later approved slice",
      "requiredApproval": "UI2_ZERO_LUX_RUNTIME_MIGRATION_NON_HOME_V1",
      "blocker": "legacy design runtime still shipping"
    },
    {
      "file": "apps/admin/app/admin/compliance/page.tsx",
      "lineOrSymbol": "183:class:className=\"p-6 text-lux-text\"",
      "classification": "LUX_RUNTIME_CLASS",
      "surface": "admin",
      "productionRuntime": true,
      "home": false,
      "accountHub": false,
      "removalMethod": "replace with spark-toss tokens/primitives in a later approved slice",
      "requiredApproval": "UI2_ZERO_LUX_RUNTIME_MIGRATION_NON_HOME_V1",
      "blocker": "legacy design runtime still shipping"
    },
    {
      "file": "apps/admin/app/admin/execution-policy/page.tsx",
      "lineOrSymbol": "215:class:className=\"p-6 text-lux-text\"",
      "classification": "LUX_RUNTIME_CLASS",
      "surface": "admin",
      "productionRuntime": true,
      "home": false,
      "accountHub": false,
      "removalMethod": "replace with spark-toss tokens/primitives in a later approved slice",
      "requiredApproval": "UI2_ZERO_LUX_RUNTIME_MIGRATION_NON_HOME_V1",
      "blocker": "legacy design runtime still shipping"
    },
    {
      "file": "apps/admin/app/admin/growth/page.tsx",
      "lineOrSymbol": "133:class:className=\"p-6 text-lux-text\"",
      "classification": "LUX_RUNTIME_CLASS",
      "surface": "admin",
      "productionRuntime": true,
      "home": false,
      "accountHub": false,
      "removalMethod": "replace with spark-toss tokens/primitives in a later approved slice",
      "requiredApproval": "UI2_ZERO_LUX_RUNTIME_MIGRATION_NON_HOME_V1",
      "blocker": "legacy design runtime still shipping"
    },
    {
      "file": "apps/admin/app/admin/ledger/page.tsx",
      "lineOrSymbol": "100:class:<p className=\"text-sm text-lux-text-muted\">{T.admin.state.loading}</p>",
      "classification": "LUX_RUNTIME_CLASS",
      "surface": "admin",
      "productionRuntime": true,
      "home": false,
      "accountHub": false,
      "removalMethod": "replace with spark-toss tokens/primitives in a later approved slice",
      "requiredApproval": "UI2_ZERO_LUX_RUNTIME_MIGRATION_NON_HOME_V1",
      "blocker": "legacy design runtime still shipping"
    },
    {
      "file": "apps/admin/app/admin/opportunities/page.tsx",
      "lineOrSymbol": "127:class:className=\"p-6 text-lux-text\"",
      "classification": "LUX_RUNTIME_CLASS",
      "surface": "admin",
      "productionRuntime": true,
      "home": false,
      "accountHub": false,
      "removalMethod": "replace with spark-toss tokens/primitives in a later approved slice",
      "requiredApproval": "UI2_ZERO_LUX_RUNTIME_MIGRATION_NON_HOME_V1",
      "blocker": "legacy design runtime still shipping"
    },
    {
      "file": "apps/admin/app/admin/reports/financial/page.tsx",
      "lineOrSymbol": "43:class:<main className=\"p-6 text-lux-text\" data-testid=\"admin-financial-page\">",
      "classification": "LUX_RUNTIME_CLASS",
      "surface": "admin",
      "productionRuntime": true,
      "home": false,
      "accountHub": false,
      "removalMethod": "replace with spark-toss tokens/primitives in a later approved slice",
      "requiredApproval": "UI2_ZERO_LUX_RUNTIME_MIGRATION_NON_HOME_V1",
      "blocker": "legacy design runtime still shipping"
    },
    {
      "file": "apps/admin/app/admin/risk/page.tsx",
      "lineOrSymbol": "270:class:className=\"p-6 text-lux-text\"",
      "classification": "LUX_RUNTIME_CLASS",
      "surface": "admin",
      "productionRuntime": true,
      "home": false,
      "accountHub": false,
      "removalMethod": "replace with spark-toss tokens/primitives in a later approved slice",
      "requiredApproval": "UI2_ZERO_LUX_RUNTIME_MIGRATION_NON_HOME_V1",
      "blocker": "legacy design runtime still shipping"
    },
    {
      "file": "apps/admin/app/admin/support/page.tsx",
      "lineOrSymbol": "101:class:className=\"mt-1 w-full max-w-md rounded border border-lux-border bg-lux-bg px-2 py-1 text-sm\"",
      "classification": "LUX_RUNTIME_CLASS",
      "surface": "admin",
      "productionRuntime": true,
      "home": false,
      "accountHub": false,
      "removalMethod": "replace with spark-toss tokens/primitives in a later approved slice",
      "requiredApproval": "UI2_ZERO_LUX_RUNTIME_MIGRATION_NON_HOME_V1",
      "blocker": "legacy design runtime still shipping"
    },
    {
      "file": "apps/admin/app/admin/system-control/page.tsx",
      "lineOrSymbol": "131:class:className=\"p-6 text-lux-text\"",
      "classification": "LUX_RUNTIME_CLASS",
      "surface": "admin",
      "productionRuntime": true,
      "home": false,
      "accountHub": false,
      "removalMethod": "replace with spark-toss tokens/primitives in a later approved slice",
      "requiredApproval": "UI2_ZERO_LUX_RUNTIME_MIGRATION_NON_HOME_V1",
      "blocker": "legacy design runtime still shipping"
    },
    {
      "file": "apps/admin/app/admin/users/[id]/finance/page.tsx",
      "lineOrSymbol": "130:class:className=\"p-6 text-lux-text\"",
      "classification": "LUX_RUNTIME_CLASS",
      "surface": "admin",
      "productionRuntime": true,
      "home": false,
      "accountHub": false,
      "removalMethod": "replace with spark-toss tokens/primitives in a later approved slice",
      "requiredApproval": "UI2_ZERO_LUX_RUNTIME_MIGRATION_NON_HOME_V1",
      "blocker": "legacy design runtime still shipping"
    },
    {
      "file": "apps/admin/app/admin/users/[id]/page.tsx",
      "lineOrSymbol": "146:class:<main className=\"p-6 text-lux-text\" data-testid=\"admin-user-detail\">",
      "classification": "LUX_RUNTIME_CLASS",
      "surface": "admin",
      "productionRuntime": true,
      "home": false,
      "accountHub": false,
      "removalMethod": "replace with spark-toss tokens/primitives in a later approved slice",
      "requiredApproval": "UI2_ZERO_LUX_RUNTIME_MIGRATION_NON_HOME_V1",
      "blocker": "legacy design runtime still shipping"
    },
    {
      "file": "apps/admin/app/admin/users/page.tsx",
      "lineOrSymbol": "26:class:<main className=\"p-6 text-lux-text\" data-testid=\"admin-users\">",
      "classification": "LUX_RUNTIME_CLASS",
      "surface": "admin",
      "productionRuntime": true,
      "home": false,
      "accountHub": false,
      "removalMethod": "replace with spark-toss tokens/primitives in a later approved slice",
      "requiredApproval": "UI2_ZERO_LUX_RUNTIME_MIGRATION_NON_HOME_V1",
      "blocker": "legacy design runtime still shipping"
    },
    {
      "file": "apps/admin/app/admin/wallet/page.tsx",
      "lineOrSymbol": "167:class:className=\"p-6 text-lux-text\"",
      "classification": "LUX_RUNTIME_CLASS",
      "surface": "admin",
      "productionRuntime": true,
      "home": false,
      "accountHub": false,
      "removalMethod": "replace with spark-toss tokens/primitives in a later approved slice",
      "requiredApproval": "UI2_ZERO_LUX_RUNTIME_MIGRATION_NON_HOME_V1",
      "blocker": "legacy design runtime still shipping"
    },
    {
      "file": "apps/admin/app/globals.css",
      "lineOrSymbol": "1:css-import:@import \"@aipo/ui/tokens/lux-theme.css\";",
      "classification": "LUX_RUNTIME_CSS",
      "surface": "admin",
      "productionRuntime": true,
      "home": false,
      "accountHub": false,
      "removalMethod": "replace with spark-toss tokens/primitives in a later approved slice",
      "requiredApproval": "UI2_ZERO_LUX_RUNTIME_MIGRATION_NON_HOME_V1",
      "blocker": "legacy design runtime still shipping"
    },
    {
      "file": "apps/admin/app/globals.css",
      "lineOrSymbol": "12:class:font-family: var(--font-lux-sans);",
      "classification": "LUX_RUNTIME_CLASS",
      "surface": "admin",
      "productionRuntime": true,
      "home": false,